{
  "schemaVersion": "1.0.0",
  "pronunciationProfileId": "pron-2243101e4d39",
  "version": 1,
  "projectId": "phase7-gps-explainer",
  "language": "en-us",
  "entries": [
    {
      "entryId": "pe-fac471181be0",
      "normalizedTerm": "l2c",
      "displayTerm": "L2C",
      "language": "en-us",
      "locale": null,
      "category": "ACRONYM",
      "reading": {
        "notation": "READ_AS",
        "value": "L two C"
      },
      "acronymMode": "CUSTOM",
      "scope": {
        "level": "PROJECT",
        "projectId": "phase7-gps-explainer",
        "scriptArtifactId": null,
        "segmentId": null
      },
      "source": "PROJECT_OVERRIDE",
      "quality": "AUTO",
      "notes": "proposed reading; owner verifies by listening",
      "provenance": {
        "createdAt": "2026-10-11T07:12:17.076Z",
        "origin": null,
        "evidenceRefs": []
      }
    },
    {
      "entryId": "pe-fc093ae4b476",
      "normalizedTerm": "l5",
      "displayTerm": "L5",
      "language": "en-us",
      "locale": null,
      "category": "ACRONYM",
      "reading": {
        "notation": "READ_AS",
        "value": "L five"
      },
      "acronymMode": "CUSTOM",
      "scope": {
        "level": "PROJECT",
        "projectId": "phase7-gps-explainer",
        "scriptArtifactId": null,
        "segmentId": null
      },
      "source": "PROJECT_OVERRIDE",
      "quality": "AUTO",
      "notes": "proposed reading; owner verifies by listening",
      "provenance": {
        "createdAt": "2026-10-11T07:12:17.076Z",
        "origin": null,
        "evidenceRefs": []
      }
    },
    {
      "entryId": "pe-1a3a613c9f15",
      "normalizedTerm": "l1c",
      "displayTerm": "L1C",
      "language": "en-us",
      "locale": null,
      "category": "ACRONYM",
      "reading": {
        "notation": "READ_AS",
        "value": "L one C"
      },
      "acronymMode": "CUSTOM",
      "scope": {
        "level": "PROJECT",
        "projectId": "phase7-gps-explainer",
        "scriptArtifactId": null,
        "segmentId": null
      },
      "source": "PROJECT_OVERRIDE",
      "quality": "AUTO",
      "notes": "proposed reading; owner verifies by listening",
      "provenance": {
        "createdAt": "2026-10-11T07:12:17.076Z",
        "origin": null,
        "evidenceRefs": []
      }
    },
    {
      "entryId": "pe-35e6a511d590",
      "normalizedTerm": "waas",
      "displayTerm": "WAAS",
      "language": "en-us",
      "locale": null,
      "category": "ACRONYM",
      "reading": {
        "notation": "READ_AS",
        "value": "W A A S"
      },
      "acronymMode": "LETTER_BY_LETTER",
      "scope": {
        "level": "PROJECT",
        "projectId": "phase7-gps-explainer",
        "scriptArtifactId": null,
        "segmentId": null
      },
      "source": "PROJECT_OVERRIDE",
      "quality": "AUTO",
      "notes": "letter-by-letter is the intelligible default; official speech says 'wahs'; owner chooses",
      "provenance": {
        "createdAt": "2026-10-11T07:12:17.076Z",
        "origin": null,
        "evidenceRefs": []
      }
    },
    {
      "entryId": "pe-86ef62a4047e",
      "normalizedTerm": "faa",
      "displayTerm": "FAA",
      "language": "en-us",
      "locale": null,
      "category": "ACRONYM",
      "reading": {
        "notation": "READ_AS",
        "value": "F A A"
      },
      "acronymMode": "LETTER_BY_LETTER",
      "scope": {
        "level": "PROJECT",
        "projectId": "phase7-gps-explainer",
        "scriptArtifactId": null,
        "segmentId": null
      },
      "source": "PROJECT_OVERRIDE",
      "quality": "AUTO",
      "notes": "proposed reading",
      "provenance": {
        "createdAt": "2026-10-11T07:12:17.076Z",
        "origin": null,
        "evidenceRefs": []
      }
    },
    {
      "entryId": "pe-c096249987a6",
      "normalizedTerm": "nist",
      "displayTerm": "NIST",
      "language": "en-us",
      "locale": null,
      "category": "ACRONYM",
      "reading": {
        "notation": "READ_AS",
        "value": "nist"
      },
      "acronymMode": "CUSTOM",
      "scope": {
        "level": "PROJECT",
        "projectId": "phase7-gps-explainer",
        "scriptArtifactId": null,
        "segmentId": null
      },
      "source": "PROJECT_OVERRIDE",
      "quality": "AUTO",
      "notes": "spoken as a word by NIST staff; owner verifies by listening",
      "provenance": {
        "createdAt": "2026-10-11T07:12:17.076Z",
        "origin": null,
        "evidenceRefs": []
      }
    }
  ],
  "provenance": {
    "source": "phase-7-script",
    "createdAt": "2026-10-11T07:12:17.076Z",
    "evidenceRefs": [
      "Report/evidence/phase-7/script/gps-script-v3.md"
    ]
  },
  "fingerprint": "4398c07cf7ce38b3"
}
